{
  "$schema": "https://json-schema.org/draft/2020-12/schema",
  "$id": "https://dna.codes/schemas/operational",
  "title": "OperationalDNA",
  "description": "A complete Operational DNA document for a business. Operational DNA describes organizational modeling — what the org is and what it does, independent of UI, API, or deployment technology. Modeled around the Actor > Action > Subject triad: Roles act, Subjects (Resource | Person | Role | Group) receive actions.\n\nOrganized in three categories:\n- People: Person, Role, Group, Membership\n- Structures: Resource, Attribute, Relationship\n- Activities: Operation, Task, Step, Process, Trigger, Rule\n\nDomain wraps the noun primitives (Resources, Persons, Roles, Groups). Memberships and Activities live at the top level of the document.",
  "type": "object",
  "required": ["domain"],
  "additionalProperties": false,
  "properties": {
    "domain": {
      "$ref": "https://dna.codes/schemas/operational/domain",
      "description": "The root domain, containing the full nested hierarchy of subdomains and noun primitives (Resources, Persons, Roles, Groups)."
    },
    "memberships": {
      "type": "array",
      "description": "Template-level eligibility statements: which Person types may hold which Roles in which Groups.",
      "items": { "$ref": "https://dna.codes/schemas/operational/membership" }
    },
    "operations": {
      "type": "array",
      "description": "All Subject.Action operation pairs defined in this domain — the atomic units of business activity. Subject is any noun primitive (Resource, Person, Role, Group).",
      "items": { "$ref": "https://dna.codes/schemas/operational/operation" }
    },
    "triggers": {
      "type": "array",
      "description": "What initiates each Operation or Process — user actions, schedules, webhooks, chained operations.",
      "items": { "$ref": "https://dna.codes/schemas/operational/trigger" }
    },
    "rules": {
      "type": "array",
      "description": "Constraints on operations — who may perform them (access rules) and what conditions must be satisfied (condition rules). Condition rules are also referenced by Step.conditions[] for compositional gating.",
      "items": { "$ref": "https://dna.codes/schemas/operational/rule" }
    },
    "relationships": {
      "type": "array",
      "description": "Named, directed connections between noun primitives — formalizes the semantic link a reference Attribute implies, adding cardinality.",
      "items": { "$ref": "https://dna.codes/schemas/operational/relationship" }
    },
    "tasks": {
      "type": "array",
      "description": "Atomic reusable units of business activity: a Role performing exactly one Operation.",
      "items": { "$ref": "https://dna.codes/schemas/operational/task" }
    },
    "processes": {
      "type": "array",
      "description": "Standard Operating Procedures — named, owned DAGs of Steps that accomplish business goals. Each Process declares an explicit `startStep` (Amazon-States-Language convention).",
      "items": { "$ref": "https://dna.codes/schemas/operational/process" }
    }
  },
  "examples": [
    {
      "domain": {
        "name": "acme",
        "path": "acme",
        "domains": [
          {
            "name": "finance",
            "path": "acme.finance",
            "domains": [
              {
                "name": "lending",
                "path": "acme.finance.lending",
                "resources": [
                  {
                    "name": "Loan",
                    "attributes": [
                      { "name": "amount", "type": "number", "required": true },
                      { "name": "status", "type": "enum", "values": ["pending", "active", "repaid"] }
                    ],
                    "actions": [
                      { "name": "Apply",   "type": "write" },
                      { "name": "Approve", "type": "write" }
                    ]
                  }
                ],
                "persons": [
                  { "name": "Borrower", "description": "External borrower; applies for loans." },
                  { "name": "Employee", "description": "Internal worker." }
                ],
                "groups": [
                  { "name": "BankDepartment", "attributes": [{ "name": "region", "type": "string" }] }
                ],
                "roles": [
                  { "name": "Underwriter", "description": "Reviews and approves loan applications.", "scope": "BankDepartment" }
                ]
              }
            ]
          }
        ]
      },
      "memberships": [
        { "name": "EmployeeUnderwriter", "person": "Employee", "role": "Underwriter" }
      ],
      "operations": [
        { "resource": "Loan", "action": "Apply",   "name": "Loan.Apply",   "changes": [{ "attribute": "loan.status", "set": "under_review" }] },
        { "resource": "Loan", "action": "Approve", "name": "Loan.Approve", "changes": [{ "attribute": "loan.status", "set": "active" }] }
      ],
      "triggers": [
        { "operation": "Loan.Apply", "source": "user" },
        { "operation": "Loan.Approve", "source": "user" }
      ],
      "rules": [
        { "operation": "Loan.Apply", "type": "access", "allow": [{ "role": "Borrower" }] },
        { "operation": "Loan.Approve", "type": "access", "allow": [{ "role": "Underwriter" }] }
      ],
      "tasks": [
        { "name": "intake-loan", "actor": "Borrower", "operation": "Loan.Apply" },
        { "name": "approve-loan", "actor": "Underwriter", "operation": "Loan.Approve" }
      ],
      "processes": [
        {
          "name": "LoanOrigination",
          "operator": "Underwriter",
          "startStep": "intake",
          "steps": [
            { "id": "intake", "task": "intake-loan" },
            { "id": "approve", "task": "approve-loan", "depends_on": ["intake"] }
          ]
        }
      ]
    }
  ]
}
